{
  "schemaVersion": "1.0.0",
  "lineageId": "lineage.execution.orders",
  "observedAt": "2026-08-12T12:31:00Z",
  "expiresAt": "2026-08-13T12:31:00Z",
  "environmentReference": "environment.production.orders",
  "targetReference": "target.postgresql.orders.flexible",
  "currentOrdinal": 0,
  "currentState": "rehearsal-reviewed",
  "acceptedExecutions": [],
  "consumedNonces": []
}
